<?xml version="1.0" encoding="UTF-8"?>
<?xml-stylesheet type="text/xsl" href="User.xsl"?>
<FIOS xmlns:xsi="http://www.w3.org/2001/XMLSchema-instance" 
xsi:noNamespaceSchemaLocation="test.xsd">
  <user>
    <id>001</id>
    <Name>Anand</Name>
    <Age>18></Age>
    <email>anand@gmail.com</email>
    <phone>9162126098</phone>
  </user>
   <user>
    <id>002</id>
    <Name>Rahul</Name>
    <Age>18></Age>
    <email>rahul@gmail.com</email>
    <phone>9162126098</phone>
  </user>
   <user>
    <id>003</id>
    <Name>Aryan</Name>
    <Age>18></Age>
    <email>aryan@gmail.com</email>
    <phone>9162126098</phone>
  </user>
   <user>
    <id>004</id>
    <Name>Abhishek</Name>
    <Age>18></Age>
    <email>abhishek@gmail.com</email>
    <phone>9162126098</phone>
  </user>
  <user>
    <id>005</id>
    <Name>Amit</Name>
    <Age>18></Age>
    <email>amit@gmail.com</email>
    <phone>9162126098</phone>
  </user>
  <user>
    <id>006</id>
    <Name>Rana</Name>
    <Age>18></Age>
    <email>rana@gmail.com</email>
    <phone>9934654773</phone>
  </user>
  <user>
    <id>007</id>
    <Name>Srishty</Name>
    <Age>18></Age>
    <email>srishty@gmail.com</email>
    <phone>6204617238</phone>
  </user>
  <user>
    <id>008</id>
    <Name>Anil</Name>
    <Age>18></Age>
    <email>anil@gmail.com</email>
    <phone>6299877413</phone>
  </user>
</FIOS>